{"benchmark_version":"0.1.0","case_count":50,"dataset_manifest_hash":"sha256:593cb5d36c31dbb52ee4ebd6ba4484caa71aab4b9551aafd535dc9b6696a82e2","dataset_version":"0.1.0","file_hashes":{"cases/adversarial.jsonl":"27b77829b79ce9639de7245812c951966858cabe23e4e4a29e89b21851e5afec","cases/development.jsonl":"10b59e7e76b06d8128e8b76e3d7f8d1ca1fdd13284525ceb5e1d7fc080d04422","cases/multi_turn.jsonl":"6c08b463a911adf872da4f8cfd74ae952703c5ccea3a19aa548c0494972a274a","cases/test_public.jsonl":"b7a5d531f60bc89b353a36d26d2380907b181e4499f4b796b4885224c14790e9","cases/validation.jsonl":"e6a532286cfdf7f6ed3208b1d073f0d9e31bf8b37f8d427444dc6bac8ad8ec10","gold/answers/ADV-SMK-000001.json":"6f183409f111092927d5ce0afa9790ae2280fdbe0d8ace2d35ad02e74754ffe3","gold/answers/ADV-SMK-000002.json":"e52ba3856f39cdd6173164ebb33208095f093daf7982e2288fa17116cf3be2e4","gold/answers/DEV-SMK-000001.json":"12dcb52bcff2f168fe7f40c1c32726df33bbc25f4ac051cdf6e50d93738f2612","gold/answers/DEV-SMK-000002.json":"bf8d292c8f5f440b3f4d6d9f300122e35b4ee3c4038fa88a84be8650b9f30ec4","gold/answers/DEV-SMK-000003.json":"c5b38bfea4c0e95ae6bf1edb89d7d4966ca11ad3a5cc311b432015780797c456","gold/answers/DEV-SMK-000004.json":"1767ef772fc2878a218b32c2445103809d822fee9dbb382e6f3d892071ddad1f","gold/answers/DEV-SMK-000005.json":"57220e23f4c8b6334ca8f977a0e31c5e691531094f46fc1a00120ef26a1a1b79","gold/answers/DEV-SMK-000006.json":"267d4dc444f6c11bbd8125d97826b615b1fef8e65a42eda8212fdcd862c2c2d8","gold/answers/DEV-SMK-000007.json":"00d4fff907d2a618320c5b44ff124809893542e0df2bca98259c4c280e6213e3","gold/answers/DEV-SMK-000008.json":"e7dc3bda0579d95586aa918bd8f7008f223ac75ff40adc9f5b412cba5929e61d","gold/answers/DEV-SMK-000009.json":"645cfc258d1628db5dfb5e86277cbd13b8db5efbb18292f7e8b21504a9ec4120","gold/answers/DEV-SMK-000010.json":"541f4fbed7529fd0ebd3cf70d1cdaec43748131fc188db3905a076d2bfcecb37","gold/answers/DEV-SMK-000011.json":"c8234bf52d8b2e85090ca4e60496ad52a252ab43e7ba9110bf409e5b736099f3","gold/answers/DEV-SMK-000012.json":"5fbefc4dc9cf0dff649bb1e7ebbb728b3ecaf7f4db3bf9aa1a3dce8d477db494","gold/answers/DEV-SMK-000013.json":"32ddfb6f80d39aae1909c9e65817b7e4059d187f07b0f0479046cf7015097146","gold/answers/DEV-SMK-000014.json":"18d0850ee91b4680c9e0ee7919b2cec78ba001b89d420e4772522f1985547307","gold/answers/DEV-SMK-000015.json":"848631a3f42431ccc02200789964baa86f9888aad8169de2e178f9b285a8272f","gold/answers/DEV-SMK-000016.json":"47c4c82cd27312f85c6c548229c5a2b741edf017f5a722d10f7d1eb227aa953d","gold/answers/DEV-SMK-000017.json":"af43e40b231db5b5061e566fb152605f830172f592a119bf1f17de8336936178","gold/answers/DEV-SMK-000018.json":"af85301b4e12a69841f405d701f425e0510b563c2a2007499908d3feccb8bf98","gold/answers/DEV-SMK-000019.json":"b5dedc9c64ac7975f84994479781b422c06b7a67a26343ad00c0c3abd9e2002e","gold/answers/DEV-SMK-000020.json":"555049da72c63a4bce0c6a54001f35795e31a3b18da67057f792e3e20948c8b8","gold/answers/DEV-SMK-000021.json":"0358dfdc4e2efb79e2d7d24cf4077f837fbf47eaf848d8d0b0eb7f9bab686a68","gold/answers/DEV-SMK-000022.json":"a66081531848242cd6354dcd2d053982f910845412d6065bb769741be0b6ce28","gold/answers/DEV-SMK-000023.json":"14af142dcf8aa4983da8fec0c5e077145bb80a94f2b5252f0f5e931a767098e7","gold/answers/DEV-SMK-000024.json":"80fee02364b5632b9f1e58d9f69a43eb11ec31bc75fb4e43c41a2259868e79d8","gold/answers/DEV-SMK-000025.json":"5888885816b8f7769a54c6a1e15222485b173db4bc77dfc9e3bc9c1e249c8d0d","gold/answers/DEV-SMK-000026.json":"a824baf45888e7e1634e0d12f178914586c610a1fdeeb88c2d1f993ea495c850","gold/answers/DEV-SMK-000027.json":"bcd838e77dd6b1df33fe15e16db7d43876688e2e93226166ecb3d1daa2570ab7","gold/answers/DEV-SMK-000028.json":"a2eb788e6e4c7636176d858ff1c13e7a389e06a927e950c912cd61af166d7741","gold/answers/DEV-SMK-000029.json":"a0055ec07204227a66e9389afdd7e6f880bedb01f414dcf2b5fb7dbeb00dbaa7","gold/answers/DEV-SMK-000030.json":"b27d4389001223dea7b562954523d45efca0e41aa4eee3b4b15babfb42f85896","gold/answers/MT-SMK-000001.json":"fcec096c26692b5da91336dd093a037a90aa63a9fcaac7f73b89e0dad6b561c5","gold/answers/MT-SMK-000002.json":"32faf62735d0699021f79753dff517880fdbbec06cceaf5712d9dabb46337cdd","gold/answers/MT-SMK-000003.json":"9b9f7e65b00fc5a845a29babdab679f0c5382ff09ff8cf260c90515c31cd04d1","gold/answers/MT-SMK-000004.json":"82d556fc6aad9e15703ad5adb9572218115b6c93c697bf2ea45eac6e8329e4bc","gold/answers/TST-PUB-SMK-000001.json":"396321fdc5a9b70d3a670c8a559b9f7e66e973beb667e915a4fabe70f0f375d9","gold/answers/TST-PUB-SMK-000002.json":"b6cffe052a42169dc04d76c6fa044d02496f293a0691653b6d99af635f729816","gold/answers/TST-PUB-SMK-000003.json":"38d3d3b559f3a0f86e59a90a0406c57685aa0281071535634c3bfa61346abd64","gold/answers/TST-PUB-SMK-000004.json":"ee992b35019997682f1cc8203e56e5d1e4088ca8c219ad5a359b7c03eb5dd578","gold/answers/VAL-SMK-000001.json":"f30c0e5e53551d34c007bfa8e2bdf0e460170d4971f566414ffdb2a7f0392df4","gold/answers/VAL-SMK-000002.json":"83a50c3a3e03b669f2f1370808f7b652d8548f31aa0f23f6828276144d970b8e","gold/answers/VAL-SMK-000003.json":"165eafa0180a982d48758454058f87b921b68e5e5710072b45436dbb5e05ef20","gold/answers/VAL-SMK-000004.json":"fdc1f4e29d9aac04c6907419825bae63a256c2360825c4b25fbcaacca551a86f","gold/answers/VAL-SMK-000005.json":"ac6bd6022aa45d48114ac6891bb8362d920b97e3abdb96b8a51084c465b6c365","gold/answers/VAL-SMK-000006.json":"851d7bba17f02b58338a628e6343bdfb6f9101a60091188a247c9ffc5e4b4034","gold/answers/VAL-SMK-000007.json":"32db502f0f7efebf4f7d822db1f595c30ecb66e41198c689d9986e5c011cec21","gold/answers/VAL-SMK-000008.json":"b11bac1e04ed8120548ec74fb67cdc8c11f9f9590df609afc9d886a6c31b7a0b","gold/answers/VAL-SMK-000009.json":"445166ea3cc1a2ef6dcbd99fd4c0d5e2c21b46152d7456a96fb329d068319d94","gold/answers/VAL-SMK-000010.json":"f1266cac7dbec7bead5eb4610a2a2750f94138ec497258971f4729c387a0c2f4","gold/plans/DEV-SMK-000001.json":"fbe249a48555627bf595cd466b492028e385df43a290f08f283fc933054d64aa","gold/plans/DEV-SMK-000002.json":"e3ddfeaf392993ffe95292e699d889192ecfdd5230efdba9d8b735a44a0e8c0d","gold/plans/DEV-SMK-000003.json":"5f3965a75ba78e9bb99bed1ca558ad6435147af86f669279148cdfcdd78e2ee6","gold/plans/DEV-SMK-000004.json":"8df67f523573d51ee8dfb1689f3071891c2a30127ff316c520c645fbcb8e8f4e","gold/plans/DEV-SMK-000005.json":"b815db7222a960e9457062ae9c86c2f5878129fd3bf8a8df65015ecbaba1c483","gold/plans/DEV-SMK-000006.json":"f911fe8f7bc44888b3c75fdd0029867a255a74e31975337bbfe6334d1c25a3a5","gold/plans/DEV-SMK-000007.json":"bd7f8d4fcf292bf23491dcab427b47ea75c9b6176e11a2e365c5cf40eac85a07","gold/plans/DEV-SMK-000008.json":"9fd8e3359607e6ab9a2c99d98d52e203cbf34e7f774475afe5e0fc68bcfa6d38","gold/plans/DEV-SMK-000009.json":"4232e8e232dc8edad3a5e965e2537ef01beb096dd5780059785001951549f2fa","gold/plans/DEV-SMK-000010.json":"ffbb26b7d886aa4b48017eedfb3f8dd692a575fe98cd2f0a50c623440bcd3dca","gold/plans/DEV-SMK-000011.json":"353a1b03ed24922462246cee0d5fcbd0f0a11d8680fe363217d46d9f66da40cf","gold/plans/DEV-SMK-000012.json":"407c8745781253d3fca3327596acc9e55cd128efbca85cb7cf94cac2f2bdfe59","gold/plans/DEV-SMK-000013.json":"9614a6e1d6606eec09872068b783538c9e282e503493e0f3ad4098824e23f659","gold/plans/DEV-SMK-000014.json":"c8857d561c36d64845fc77bec7ceca1ebc5e479f441ac301fc9aceea91cec6c6","gold/plans/DEV-SMK-000015.json":"aa67fd43a75f0e4f25fb25e9ff8481eb2869b62b932d9e9da5f1303fe0a359cf","gold/plans/DEV-SMK-000016.json":"c8cb8695389dc6ccdc1bd1cef9faa4cfab859da62ace82f4035acaa5798eb720","gold/plans/DEV-SMK-000017.json":"f4ef3bde98823708f283d14732b758d1aea113687a8c44717084c69438d66007","gold/plans/DEV-SMK-000018.json":"603b41a3c600343ec8732f323458179bb5835848f0966c00b29f352c9e12d0e4","gold/plans/DEV-SMK-000019.json":"707472d8ff54f42a5b383f7aebc1f7548f4d400f72209d17a0761170aca0c913","gold/plans/DEV-SMK-000020.json":"7e397a332c6aa587d60bc23bf521bf2fd8b162b7605224172a353c8d985aa1eb","gold/plans/DEV-SMK-000021.json":"384d152fc94d95943f18cc5085a17d14d35a63650853974905a8c2da65311e55","gold/plans/DEV-SMK-000022.json":"70591ccaabd246024da024880e8ad962a563deb030173e96cbe2dcd322377418","gold/plans/DEV-SMK-000023.json":"4db3de806ce691fa8a266521fbfa091d40c87af2af865fbbe2a8371775546997","gold/plans/DEV-SMK-000024.json":"fc08924f1bda81e98403aaa8d32a59792e8d53879a687788d7f3e0c1f8251b47","gold/plans/DEV-SMK-000025.json":"d06362610d7a2d5b7dea52cc76ff84f96270a1b28212e1860d8285370f9e9f11","gold/plans/DEV-SMK-000026.json":"f81511bf21240c1865a9c48a469fac375c9c423ce8f3419384c649f2022f14b7","gold/plans/DEV-SMK-000027.json":"10e4544f21b7fa77825b95377cc0056a5c2ad05785c962039f41f645c494818d","gold/plans/DEV-SMK-000028.json":"1e3f19036de45270afe7851f5253253790c661438b038471d074549e2adcbf46","gold/plans/DEV-SMK-000029.json":"1c605f8b6733c8ab0773c0bcb808e50088e469b08a84755107e9c59b940cdeaa","gold/plans/DEV-SMK-000030.json":"88be69a305623c309fd9a48311fbd61da3a30740e33a25523f8d52c13bdf419d","gold/plans/TST-PUB-SMK-000001.json":"977132bf583672570af970372ff7076a4fe274307ec99399165262d8f4531903","gold/plans/TST-PUB-SMK-000002.json":"2c48c57f336a93c1a4521e0375be57dd241d8c227db865c75d960a6248b23974","gold/plans/TST-PUB-SMK-000003.json":"233f7b8b12197d0bb88624b2ee5f42895de95ee766dec681c13a8d92ab3896b1","gold/plans/TST-PUB-SMK-000004.json":"1a2fb220735a7e5ce356b2ad5b149d861e616cb460e0d7c917cfd417a343ec16","gold/plans/VAL-SMK-000001.json":"ba08b278688ad7f3b1b9d6f2a1c794aaba0993f7735bfb56a8b910638892af7c","gold/plans/VAL-SMK-000002.json":"77a2c73d9f16a582bf264505086f3f3e55189ce30f4338b0069433616b73ff99","gold/plans/VAL-SMK-000003.json":"f5566dea2a26164240801861bd2795d022509e484115d3e6a78f28f842dfae9b","gold/plans/VAL-SMK-000004.json":"9c6936781f840f53e00220b67863894b6e449f8bf6e89aa0cfe7931f8d84bd68","gold/plans/VAL-SMK-000005.json":"b0f7ec0d0a571f3e6c17fb08139c6295e0727f5735896bff61f08c11d98b905d","gold/plans/VAL-SMK-000006.json":"e76a8097f164ee9dca5a80c73b9e01ce40b4b6bfeb70908e700939f83aeaf54f","gold/plans/VAL-SMK-000007.json":"b03a83ea382076fedc6b4c07f31fa6197b5f74c086574b324147ba6262155fd2","gold/plans/VAL-SMK-000008.json":"4318c329ccf40891b80c50765e9a641a5ace88ee6857104f76f5dfa2e3ffb80f","gold/plans/VAL-SMK-00000